{
  "schema_version": "1.0",
  "name": "Oil condition lifecycle",
  "scope_id": "synthetic:oil",
  "audience": "working-agent",
  "description": "Synthetic host-classified condition evidence: redelivery, correlated reports, useful change, context invalidation, matching recovery, historical evidence, recurrence and direct stop. No native hooks or models run.",
  "events": [
    {
      "id": "run-1",
      "source": "fixture",
      "scope_id": "synthetic:oil",
      "at": "2026-10-01T09:00:00Z",
      "kind": "observation",
      "matter_key": "validation-condition",
      "occurrence_id": "execution-1",
      "classification": "routine",
      "context_revision": "v1",
      "condition_id": "condition-1",
      "host_qualified": true,
      "effective_at": "2026-10-01T09:00:00Z"
    },
    {
      "id": "run-1",
      "source": "fixture",
      "scope_id": "synthetic:oil",
      "at": "2026-10-01T09:01:00Z",
      "kind": "observation",
      "matter_key": "validation-condition",
      "occurrence_id": "execution-1",
      "classification": "routine",
      "context_revision": "v1",
      "condition_id": "condition-1",
      "host_qualified": true,
      "effective_at": "2026-10-01T09:00:00Z"
    },
    {
      "id": "report-1",
      "source": "second-report",
      "scope_id": "synthetic:oil",
      "at": "2026-10-01T09:02:00Z",
      "kind": "observation",
      "matter_key": "validation-condition",
      "occurrence_id": "execution-1",
      "classification": "routine",
      "context_revision": "v1",
      "condition_id": "condition-1",
      "host_qualified": true,
      "effective_at": "2026-10-01T09:00:00Z"
    },
    {
      "id": "run-2",
      "source": "fixture",
      "scope_id": "synthetic:oil",
      "at": "2026-10-01T09:03:00Z",
      "kind": "observation",
      "matter_key": "validation-condition",
      "occurrence_id": "execution-2",
      "classification": "material",
      "context_revision": "v1",
      "condition_id": "condition-1",
      "host_qualified": true,
      "effective_at": "2026-10-01T09:03:00Z"
    },
    {
      "id": "boundary-1",
      "source": "fixture",
      "scope_id": "synthetic:oil",
      "at": "2026-10-01T09:04:00Z",
      "kind": "delivery_boundary",
      "matter_key": "validation-condition"
    },
    {
      "id": "run-3",
      "source": "fixture",
      "scope_id": "synthetic:oil",
      "at": "2026-10-01T09:05:00Z",
      "kind": "observation",
      "matter_key": "validation-condition",
      "occurrence_id": "execution-3",
      "classification": "routine",
      "context_revision": "v1",
      "condition_id": "condition-1",
      "host_qualified": true,
      "effective_at": "2026-10-01T09:05:00Z"
    },
    {
      "id": "boundary-2",
      "source": "fixture",
      "scope_id": "synthetic:oil",
      "at": "2026-10-01T09:06:00Z",
      "kind": "delivery_boundary",
      "matter_key": "validation-condition"
    },
    {
      "id": "run-4",
      "source": "fixture",
      "scope_id": "synthetic:oil",
      "at": "2026-10-01T09:07:00Z",
      "kind": "observation",
      "matter_key": "validation-condition",
      "occurrence_id": "execution-4",
      "classification": "material",
      "context_revision": "v1",
      "condition_id": "condition-1",
      "host_qualified": true,
      "effective_at": "2026-10-01T09:07:00Z"
    },
    {
      "id": "tree-2",
      "source": "fixture",
      "scope_id": "synthetic:oil",
      "at": "2026-10-01T09:08:00Z",
      "kind": "context_change",
      "matter_key": "validation-condition",
      "context_revision": "v2"
    },
    {
      "id": "boundary-3",
      "source": "fixture",
      "scope_id": "synthetic:oil",
      "at": "2026-10-01T09:09:00Z",
      "kind": "delivery_boundary",
      "matter_key": "validation-condition"
    },
    {
      "id": "run-5",
      "source": "fixture",
      "scope_id": "synthetic:oil",
      "at": "2026-10-01T09:10:00Z",
      "kind": "observation",
      "matter_key": "validation-condition",
      "occurrence_id": "execution-5",
      "classification": "material",
      "context_revision": "v2",
      "condition_id": "condition-1",
      "host_qualified": true,
      "effective_at": "2026-10-01T09:10:00Z"
    },
    {
      "id": "other-pass",
      "source": "fixture",
      "scope_id": "synthetic:oil",
      "at": "2026-10-01T09:11:00Z",
      "kind": "observation",
      "matter_key": "validation-condition",
      "occurrence_id": "other-execution",
      "classification": "resolution",
      "context_revision": "v2",
      "condition_id": "other-condition",
      "host_qualified": true,
      "effective_at": "2026-10-01T09:11:00Z"
    },
    {
      "id": "unqualified-pass",
      "source": "fixture",
      "scope_id": "synthetic:oil",
      "at": "2026-10-01T09:12:00Z",
      "kind": "observation",
      "matter_key": "validation-condition",
      "occurrence_id": "unqualified-execution",
      "classification": "resolution",
      "context_revision": "v2",
      "condition_id": "condition-1",
      "host_qualified": false,
      "effective_at": "2026-10-01T09:12:00Z"
    },
    {
      "id": "matching-pass",
      "source": "fixture",
      "scope_id": "synthetic:oil",
      "at": "2026-10-01T09:13:00Z",
      "kind": "observation",
      "matter_key": "validation-condition",
      "occurrence_id": "passing-execution",
      "classification": "resolution",
      "context_revision": "v2",
      "condition_id": "condition-1",
      "host_qualified": true,
      "effective_at": "2026-10-01T09:13:00Z"
    },
    {
      "id": "boundary-4",
      "source": "fixture",
      "scope_id": "synthetic:oil",
      "at": "2026-10-01T09:14:00Z",
      "kind": "delivery_boundary",
      "matter_key": "validation-condition"
    },
    {
      "id": "late-report",
      "source": "fixture",
      "scope_id": "synthetic:oil",
      "at": "2026-10-01T09:15:00Z",
      "kind": "observation",
      "matter_key": "validation-condition",
      "occurrence_id": "old-execution",
      "classification": "routine",
      "context_revision": "v2",
      "condition_id": "condition-1",
      "host_qualified": true,
      "effective_at": "2026-10-01T09:11:00Z"
    },
    {
      "id": "recurrence",
      "source": "fixture",
      "scope_id": "synthetic:oil",
      "at": "2026-10-01T09:16:00Z",
      "kind": "observation",
      "matter_key": "validation-condition",
      "occurrence_id": "execution-6",
      "classification": "material",
      "context_revision": "v2",
      "condition_id": "condition-1",
      "host_qualified": true,
      "effective_at": "2026-10-01T09:16:00Z"
    },
    {
      "id": "boundary-5",
      "source": "fixture",
      "scope_id": "synthetic:oil",
      "at": "2026-10-01T09:17:00Z",
      "kind": "delivery_boundary",
      "matter_key": "validation-condition"
    },
    {
      "id": "stop-1",
      "source": "fixture",
      "scope_id": "synthetic:oil",
      "at": "2026-10-01T09:18:00Z",
      "kind": "control",
      "instruction": "stop"
    },
    {
      "id": "paused-occurrence",
      "source": "fixture",
      "scope_id": "synthetic:oil",
      "at": "2026-10-01T09:19:00Z",
      "kind": "observation",
      "matter_key": "validation-condition",
      "occurrence_id": "execution-7",
      "classification": "material",
      "context_revision": "v2",
      "condition_id": "condition-1",
      "host_qualified": true,
      "effective_at": "2026-10-01T09:19:00Z"
    },
    {
      "id": "boundary-6",
      "source": "fixture",
      "scope_id": "synthetic:oil",
      "at": "2026-10-01T09:20:00Z",
      "kind": "delivery_boundary",
      "matter_key": "validation-condition"
    }
  ],
  "expected": {
    "outcomes": [
      "recorded",
      "duplicate",
      "correlated_report",
      "eligible",
      "delivered",
      "recorded",
      "quiet",
      "eligible",
      "invalidated",
      "quiet",
      "eligible",
      "resolution_unmatched",
      "resolution_unqualified",
      "resolved",
      "quiet",
      "historical_observation",
      "eligible",
      "delivered",
      "forwarded_control",
      "recorded_while_paused",
      "quiet"
    ],
    "delivered_updates": 2,
    "forwarded_controls": [
      "stop-1"
    ],
    "matters": {
      "validation-condition": {
        "status": "open",
        "observations": 12,
        "distinct_occurrences": 7,
        "episodes": 2,
        "queued_updates": 0
      }
    }
  }
}
